{"DateOfBirth":"١٦-٠٢-٢٠٠٦","UserName":"mohamed","Contacts":{},"Starred":{},"Trash":{},"Inbox":{},"Name":"Mohamed","Password":"00000000","Sent":{"Email1":{"Importance":1,"Object":"Hello","From":"mohamed","To":"ahmed","Body":"<p>How are U?<\/p>","Date":"٢٩-١٢-٢٠٢١ ٠٧:٠٦:٥٩"},"Email2":{"Importance":4,"Object":"Hello","From":"mohamed","To":"ahmed","Body":"<p>How are U?<\/p>","Date":"٢٩-١٢-٢٠٢١ ٠٧:٠٥:٥٤"}},"Drafts":{}}